{
  "kind": "source-observation",
  "schemaVersion": "1.1.0",
  "id": "import-review-next-row-6",
  "version": "1.0.0",
  "evidenceRefs": [
    {
      "artifactId": "import-review-next",
      "locator": {
        "kind": "json-pointer",
        "pointer": "/records/5"
      }
    },
    {
      "artifactId": "import-review-next",
      "locator": {
        "kind": "json-pointer",
        "pointer": "/records/0"
      }
    }
  ],
  "extractor": {
    "name": "tyr-bounded-files",
    "version": "1.0.0"
  },
  "claims": [
    {
      "field": "raw",
      "value": {
        "id": "alias",
        "kind": "alias",
        "target": "pump-1"
      },
      "certainty": "explicit"
    },
    {
      "field": "derivation",
      "value": {
        "id": "row-6",
        "raw": {
          "id": "alias",
          "kind": "alias",
          "target": "pump-1"
        },
        "locator": {
          "kind": "json-pointer",
          "pointer": "/records/5"
        },
        "derivation": [
          {
            "kind": "json-pointer",
            "pointer": "/records/5"
          },
          {
            "kind": "json-pointer",
            "pointer": "/records/0"
          }
        ],
        "issues": [],
        "assumptions": [],
        "draft": {
          "kind": "source-definition",
          "schemaVersion": "2.2.0",
          "id": "imp-review-next-alias",
          "version": "1.0.0",
          "equipmentInstanceId": "import-line",
          "connectionProfileRef": "import-3",
          "accessProfileRef": "melsec-device-v1",
          "status": "draft",
          "rawAddressText": "D5999",
          "addressRadix": 10,
          "access": {
            "kind": "device-register",
            "deviceArea": "D",
            "addressIndex": 5999,
            "addressUnit": "word16",
            "wordCount": 1,
            "bitOffset": null
          },
          "rawRepresentation": {
            "mode": "bytes",
            "valueType": "UInt16",
            "byteOrder": "little",
            "wordOrder": "low-first"
          },
          "inputStage": "raw",
          "unit": {
            "status": "known",
            "code": "kPa"
          },
          "evidenceRefs": [
            {
              "artifactId": "import-review-next",
              "locator": {
                "kind": "json-pointer",
                "pointer": "/records/5"
              }
            },
            {
              "artifactId": "import-review-next",
              "locator": {
                "kind": "json-pointer",
                "pointer": "/records/0"
              }
            }
          ],
          "viewOf": null
        }
      },
      "certainty": "inferred"
    }
  ],
  "status": "partial"
}
