{
  "kind": "source-observation",
  "schemaVersion": "1.1.0",
  "id": "import-review-next-row-0",
  "version": "1.0.0",
  "evidenceRefs": [
    {
      "artifactId": "import-review-next",
      "locator": {
        "kind": "json-pointer",
        "pointer": "/records/0"
      }
    }
  ],
  "extractor": {
    "name": "tyr-bounded-files",
    "version": "1.0.0"
  },
  "claims": [
    {
      "field": "raw",
      "value": {
        "id": "pump-0",
        "kind": "source",
        "profile": "melsec-device-v1",
        "address": "D5000",
        "type": "UInt16",
        "unit": "kPa",
        "stage": "raw",
        "byteOrder": "little",
        "wordOrder": "low-first",
        "width": 1
      },
      "certainty": "explicit"
    },
    {
      "field": "derivation",
      "value": {
        "id": "row-0",
        "raw": {
          "id": "pump-0",
          "kind": "source",
          "profile": "melsec-device-v1",
          "address": "D5000",
          "type": "UInt16",
          "unit": "kPa",
          "stage": "raw",
          "byteOrder": "little",
          "wordOrder": "low-first",
          "width": 1
        },
        "locator": {
          "kind": "json-pointer",
          "pointer": "/records/0"
        },
        "derivation": [
          {
            "kind": "json-pointer",
            "pointer": "/records/0"
          }
        ],
        "issues": [],
        "assumptions": [],
        "draft": {
          "kind": "source-definition",
          "schemaVersion": "2.2.0",
          "id": "imp-review-next-pump-0",
          "version": "1.0.0",
          "equipmentInstanceId": "import-line",
          "connectionProfileRef": "import-3",
          "accessProfileRef": "melsec-device-v1",
          "status": "draft",
          "rawAddressText": "D5000",
          "addressRadix": 10,
          "access": {
            "kind": "device-register",
            "deviceArea": "D",
            "addressIndex": 5000,
            "addressUnit": "word16",
            "wordCount": 1,
            "bitOffset": null
          },
          "rawRepresentation": {
            "mode": "bytes",
            "valueType": "UInt16",
            "byteOrder": "little",
            "wordOrder": "low-first"
          },
          "inputStage": "raw",
          "unit": {
            "status": "known",
            "code": "kPa"
          },
          "evidenceRefs": [
            {
              "artifactId": "import-review-next",
              "locator": {
                "kind": "json-pointer",
                "pointer": "/records/0"
              }
            }
          ],
          "viewOf": null
        },
        "template": {
          "id": "pump",
          "kind": "template",
          "profile": "melsec-device-v1",
          "address": "D{offset}",
          "base": 5000,
          "stride": 2,
          "count": 2,
          "type": "UInt16",
          "unit": "kPa",
          "stage": "raw",
          "byteOrder": "little",
          "wordOrder": "low-first",
          "width": 1,
          "overrides": {
            "1": {
              "address": "D5999"
            }
          }
        }
      },
      "certainty": "inferred"
    }
  ],
  "status": "partial"
}
