{
  "kind": "source-observation",
  "schemaVersion": "1.1.0",
  "id": "import-review-next-row-3",
  "version": "1.0.0",
  "evidenceRefs": [
    {
      "artifactId": "import-review-next",
      "locator": {
        "kind": "json-pointer",
        "pointer": "/records/2"
      }
    }
  ],
  "extractor": {
    "name": "tyr-bounded-files",
    "version": "1.0.0"
  },
  "claims": [
    {
      "field": "raw",
      "value": {
        "id": "speed-ab",
        "profile": "ab-logix-symbol-v1",
        "address": "Motor.ActualSpeedV2",
        "type": "Float32",
        "unit": "rpm",
        "stage": "already-engineered"
      },
      "certainty": "explicit"
    },
    {
      "field": "derivation",
      "value": {
        "id": "row-3",
        "raw": {
          "id": "speed-ab",
          "profile": "ab-logix-symbol-v1",
          "address": "Motor.ActualSpeedV2",
          "type": "Float32",
          "unit": "rpm",
          "stage": "already-engineered"
        },
        "locator": {
          "kind": "json-pointer",
          "pointer": "/records/2"
        },
        "derivation": [
          {
            "kind": "json-pointer",
            "pointer": "/records/2"
          }
        ],
        "issues": [],
        "assumptions": [],
        "draft": {
          "kind": "source-definition",
          "schemaVersion": "2.2.0",
          "id": "imp-review-next-speed-ab",
          "version": "1.0.0",
          "equipmentInstanceId": "import-line",
          "connectionProfileRef": "import-0",
          "accessProfileRef": "ab-logix-symbol-v1",
          "status": "draft",
          "rawAddressText": "Motor.ActualSpeedV2",
          "addressRadix": null,
          "access": {
            "kind": "symbol",
            "symbolPath": "Motor.ActualSpeedV2"
          },
          "rawRepresentation": {
            "mode": "typed",
            "valueType": "Float32"
          },
          "inputStage": "already-engineered",
          "unit": {
            "status": "known",
            "code": "rpm"
          },
          "evidenceRefs": [
            {
              "artifactId": "import-review-next",
              "locator": {
                "kind": "json-pointer",
                "pointer": "/records/2"
              }
            }
          ],
          "viewOf": null
        }
      },
      "certainty": "inferred"
    }
  ],
  "status": "partial"
}
