{
  "kind": "source-observation",
  "schemaVersion": "1.1.0",
  "id": "import-legacy-clean-row-3",
  "version": "1.0.0",
  "evidenceRefs": [
    {
      "artifactId": "import-legacy-clean",
      "locator": {
        "kind": "json-pointer",
        "pointer": "/records/3"
      }
    }
  ],
  "extractor": {
    "name": "tyr-bounded-files",
    "version": "1.0.0"
  },
  "claims": [
    {
      "field": "raw",
      "value": {
        "id": "pressure-mel",
        "profile": "melsec-device-v1",
        "address": "D1000",
        "type": "UInt16",
        "width": 1,
        "unit": "kPa",
        "byteOrder": "little",
        "wordOrder": "low-first",
        "stage": "raw"
      },
      "certainty": "explicit"
    },
    {
      "field": "derivation",
      "value": {
        "id": "row-3",
        "raw": {
          "id": "pressure-mel",
          "profile": "melsec-device-v1",
          "address": "D1000",
          "type": "UInt16",
          "width": 1,
          "unit": "kPa",
          "byteOrder": "little",
          "wordOrder": "low-first",
          "stage": "raw"
        },
        "locator": {
          "kind": "json-pointer",
          "pointer": "/records/3"
        },
        "derivation": [
          {
            "kind": "json-pointer",
            "pointer": "/records/3"
          }
        ],
        "issues": [],
        "assumptions": [],
        "draft": {
          "kind": "source-definition",
          "schemaVersion": "2.2.0",
          "id": "imp-legacy-clean-pressure-mel",
          "version": "1.0.0",
          "equipmentInstanceId": "import-line",
          "connectionProfileRef": "import-3",
          "accessProfileRef": "melsec-device-v1",
          "status": "draft",
          "rawAddressText": "D1000",
          "addressRadix": 10,
          "access": {
            "kind": "device-register",
            "deviceArea": "D",
            "addressIndex": 1000,
            "addressUnit": "word16",
            "wordCount": 1,
            "bitOffset": null
          },
          "rawRepresentation": {
            "mode": "bytes",
            "valueType": "UInt16",
            "byteOrder": "little",
            "wordOrder": "low-first"
          },
          "inputStage": "raw",
          "unit": {
            "status": "known",
            "code": "kPa"
          },
          "evidenceRefs": [
            {
              "artifactId": "import-legacy-clean",
              "locator": {
                "kind": "json-pointer",
                "pointer": "/records/3"
              }
            }
          ],
          "viewOf": null
        }
      },
      "certainty": "inferred"
    }
  ],
  "status": "partial"
}
