{
  "kind": "source-observation",
  "schemaVersion": "1.1.0",
  "id": "import-review-base-row-2",
  "version": "1.0.0",
  "evidenceRefs": [
    {
      "artifactId": "import-review-base",
      "locator": {
        "kind": "json-pointer",
        "pointer": "/records/2"
      }
    }
  ],
  "extractor": {
    "name": "tyr-bounded-files",
    "version": "1.0.0"
  },
  "claims": [
    {
      "field": "raw",
      "value": {
        "id": "pressure-db",
        "profile": "s7-300-db-v1",
        "address": "DB10.DBB64",
        "type": "UInt16",
        "width": 2,
        "unit": "kPa",
        "byteOrder": "big",
        "wordOrder": "high-first",
        "stage": "raw"
      },
      "certainty": "explicit"
    },
    {
      "field": "derivation",
      "value": {
        "id": "row-2",
        "raw": {
          "id": "pressure-db",
          "profile": "s7-300-db-v1",
          "address": "DB10.DBB64",
          "type": "UInt16",
          "width": 2,
          "unit": "kPa",
          "byteOrder": "big",
          "wordOrder": "high-first",
          "stage": "raw"
        },
        "locator": {
          "kind": "json-pointer",
          "pointer": "/records/2"
        },
        "derivation": [
          {
            "kind": "json-pointer",
            "pointer": "/records/2"
          }
        ],
        "issues": [],
        "assumptions": [],
        "draft": {
          "kind": "source-definition",
          "schemaVersion": "2.2.0",
          "id": "imp-review-base-pressure-db",
          "version": "1.0.0",
          "equipmentInstanceId": "import-line",
          "connectionProfileRef": "import-2",
          "accessProfileRef": "s7-300-db-v1",
          "status": "draft",
          "rawAddressText": "DB10.DBB64",
          "addressRadix": null,
          "access": {
            "kind": "db-offset",
            "dbNumber": 10,
            "byteOffset": 64,
            "byteLength": 2,
            "bitOffset": null
          },
          "rawRepresentation": {
            "mode": "bytes",
            "valueType": "UInt16",
            "byteOrder": "big",
            "wordOrder": "high-first"
          },
          "inputStage": "raw",
          "unit": {
            "status": "known",
            "code": "kPa"
          },
          "evidenceRefs": [
            {
              "artifactId": "import-review-base",
              "locator": {
                "kind": "json-pointer",
                "pointer": "/records/2"
              }
            }
          ],
          "viewOf": null
        }
      },
      "certainty": "inferred"
    }
  ],
  "status": "partial"
}
