{
  "kind": "source-observation",
  "schemaVersion": "1.1.0",
  "id": "import-review-next-row-4",
  "version": "1.0.0",
  "evidenceRefs": [
    {
      "artifactId": "import-review-next",
      "locator": {
        "kind": "json-pointer",
        "pointer": "/records/3"
      }
    }
  ],
  "extractor": {
    "name": "tyr-bounded-files",
    "version": "1.0.0"
  },
  "claims": [
    {
      "field": "raw",
      "value": {
        "id": "pressure-ua",
        "profile": "s7-1500-opcua-v1",
        "address": "Line.IncomingPressure",
        "namespaceUri": "urn:tyr:synthetic:line",
        "identifierType": "string",
        "type": "Float32",
        "unit": "kPa",
        "stage": "already-engineered"
      },
      "certainty": "explicit"
    },
    {
      "field": "derivation",
      "value": {
        "id": "row-4",
        "raw": {
          "id": "pressure-ua",
          "profile": "s7-1500-opcua-v1",
          "address": "Line.IncomingPressure",
          "namespaceUri": "urn:tyr:synthetic:line",
          "identifierType": "string",
          "type": "Float32",
          "unit": "kPa",
          "stage": "already-engineered"
        },
        "locator": {
          "kind": "json-pointer",
          "pointer": "/records/3"
        },
        "derivation": [
          {
            "kind": "json-pointer",
            "pointer": "/records/3"
          }
        ],
        "issues": [],
        "assumptions": [],
        "draft": {
          "kind": "source-definition",
          "schemaVersion": "2.2.0",
          "id": "imp-review-next-pressure-ua",
          "version": "1.0.0",
          "equipmentInstanceId": "import-line",
          "connectionProfileRef": "import-1",
          "accessProfileRef": "s7-1500-opcua-v1",
          "status": "draft",
          "rawAddressText": "Line.IncomingPressure",
          "addressRadix": null,
          "access": {
            "kind": "opcua-node",
            "namespaceUri": "urn:tyr:synthetic:line",
            "identifierType": "string",
            "identifier": "Line.IncomingPressure"
          },
          "rawRepresentation": {
            "mode": "typed",
            "valueType": "Float32"
          },
          "inputStage": "already-engineered",
          "unit": {
            "status": "known",
            "code": "kPa"
          },
          "evidenceRefs": [
            {
              "artifactId": "import-review-next",
              "locator": {
                "kind": "json-pointer",
                "pointer": "/records/3"
              }
            }
          ],
          "viewOf": null
        }
      },
      "certainty": "inferred"
    }
  ],
  "status": "partial"
}
